labelpredict	labelreal	review
0	0	You may link your account with others??services so that they can look up your contacts??profiles, post your shares on such platforms, or start conversations with your connections on such platforms
0	0	Excerpts from your profile will also appear on the services of others.
0	0	Subject to your settings, other services may look-up your profile
0	0	When you opt to link your account with other services, personal data will become available to them
0	0	The sharing and use of that personal data will be described in, or linked to, a consent screen when you opt to link the accounts
0	0	For example, you may link your Twitter or WeChat account to share content from our Services into these other services, or your email provider may give you the option to upload your LinkedIn contacts into its own service
0	0	You may revoke the link with such accounts.
0	0	Subject to your settings, excerpts from your profile will appear on the services of others (e.g., search engine results, mail and calendar applications that show a user a ¡°mini??LinkedIn profile of the person they are meeting or messaging, social media aggregators
0	0	¡°Old??profile information remains on these services until they update their data cache with changes you made to your profile.
0	0	We will share your personal data with our affiliates to provide and develop our Services
0	0	We may combine information internally across the different Services covered by this Privacy Policy to help our Services be more relevant and useful to you and others
0	0	For example, SlideShare will recommend better content to you based on your LinkedIn profile or the articles you read on the LinkedIn Services, and we can personalize your feed or job recommendations based on your learning video history, because we are able to identify you across different Services using cookies or similar technologies.
3	0	We may use others to help us with our Services.
3	0	We use others to help us provide our Services (e.g., maintenance, analysis, audit, payments, fraud detection, marketing and development)
0	0	They will have access to your information as reasonably necessary to perform these tasks on our behalf and are obligated not to disclose or use it for other purposes.
0	0	We may need to share your data when we believe it¡¯s required by law or to help protect the rights and safety of you, us or others.
0	0	It is possible that we will need to disclose information about you when required by law, subpoena, or other legal process or if we have a good faith belief that disclosure is reasonably necessary to (1) investigate, prevent, or take action regarding suspected or actual illegal activities or to assist government enforcement agencies; (2) enforce our agreements with you, (3) investigate and defend ourselves against any third-party claims or allegations, (4) protect the security or integrity of our Service (such as by sharing with companies facing similar threats); or (5) exercise or protect the rights and safety of LinkedIn, our Members, personnel, or others
0	0	We attempt to notify Members about legal demands for their personal data when appropriate in our judgment, unless prohibited by law or court order or when the request is an emergency
0	0	We may dispute such demands when we believe, in our discretion, that the requests are overbroad, vague or lack proper authority, but we do not promise to challenge every demand
0	0	To learn more see our Data Request Guidelines and Transparency Report.
0	0	We may share your data when our business is sold to others, but it must continue to be used in accordance with this Privacy Policy.
0	0	Any other entity which buys us or part of our business will have the right to continue to use your data, but only in the manner set out in this Privacy Policy unless you agree otherwise.
2	2	We keep most of your personal data for as long as your account is open.
2	2	We retain your personal data while your account is in existence or as needed to provide you Services.
0	0	 This includes data you or others provided to us and data generated or inferred from your use of our Services
0	0	Even if you only use our Services when looking for a new job every few years, we will retain your information and keep your profile open until you decide to close your account.In some cases we choose to retain certain information (e.g., visits to sites carrying our ¡°share with LinkedIn??or ¡°apply with LinkedIn??plugins without clicking on the plugin) in a depersonalized or aggregated form.
6	6	You can access or delete your personal data
0	0	You have many choices about how your data is collected, used and shared.
0	0	We provide many choices about the collection, use and sharing of your data, from deleting or correcting data you include in your profile and controlling the visibility of your posts to advertising opt-outs and communication controls
0	0	We offer you settings to control and manage the personal data we have about you (for SlideShare, please contact us).
0	0	For personal data that we have about you:
6	8	Delete Data: You can ask us to erase or delete all or some of your personal data (e.g., if it is no longer necessary to provide Services to you).
6	6	Change or Correct Data: You can edit some of your personal data through your account.
6	0	 You can also ask us to change, update or fix your data in certain cases, particularly if it¡¯s inaccurate.
7	8	Object to, or Limit or Restrict, Use of Data: You can ask us to stop using all or some of your personal data (e.g., if we have no legal right to keep using it) or to limit our use of it (e.g., if your personal data is inaccurate or unlawfully held).
9	9	Right to Access and/or Take Your Data: You can asus for a copy of your personal data and can ask for a copy of personal data you provided in machine readable form.
0	0	Visitors can learn more about how to make these requests here
4	4	You may also contact us using the contact information below, and we will consider your request in accordance with applicable laws.
0	0	Residents in the Designated Countries may have additional rights under their laws
0	0	We keep some of your data even after you close your account.
0	0	If you choose to close your Linkedin (or SlideShare) account, your personal data will generally stop being visible to others on our Services within 24 hours
2	0	We generally delete closed account information within 30 days of account closure, except as noted below.
2	0	We retain your personal data even after you have closed your account if reasonably necessary to comply with our legal obligations (including law enforcement requests), meet regulatory requirements, resolve disputes, maintain security, prevent fraud and abuse, enforce our User Agreement, or fulfill your request to ¡°unsubscribe??from further messages from us
2	0	We will retain de-personalized information after your account has been closed.
0	0	Information you have shared with others (e.g., through InMail, updates or group posts) will remain visible after you closed your account or deleted the information from your own profile or mailbox, and we do not control data that other Members copied out of our Services
0	0	Groups content and ratings or review content associated with closed accounts will show an unknown user as the source
0	0	Your profile may continue to be displayed in the services of others (e.g., search engine results) until they refresh their cache.
0	0	We monitor for and try to prevent security breaches
0	0	Please use the security features available through our Services.
0	0	We implement security safeguards designed to protect your data, such as HTTPS
0	0	We regularly monitor our systems for possible vulnerabilities and attacks
0	0	However, we cannot warrant the security of any information that you send us
0	0	There is no guarantee that data may not be accessed, disclosed, altered, or destroyed by breach of any of our physical, technical, or managerial safeguards
0	0	Please visit our Safety Center for additional information about safely using our Services, including two-factor authentication.
0	0	We store and use your data outside your country.
3	0	We process data both inside and outside of the United States and rely on legally-provided mechanisms to lawfully transfer data across borders
0	0	Countries where we process data may have laws which are different, and potentially not as protective, as the laws of your own country.
0	0	5.3 Lawful Bases for Processing
0	0	We have lawful bases to collect, use and share data about you
0	0	You have choices about our use of your data.
0	0	At any time, you can withdraw consent you have provided by going to settings.
0	1	We will only collect and process personal data about you where we have lawful bases
0	0	Lawful bases include consent
0	0	(where you have given consent), contract (where processing is necessary for the performance of a contract with you (e.g
3	0	to deliver the LinkedIn Services you have requested)) and ¡°legitimate interests??
8	6	Where we rely on your consent to process personal data, you have the right to withdraw or decline your consent at any time and where we rely on legitimate interests, you have the right to object
4	4	If you have any questions about the lawful bases upon which we collect and use your personal data, please contact our Data Protection Officer her
0	0	Direct Marketing and Do Not Track Signals
0	0	Our statements regarding direct marketing and ¡°do not track??signals.
0	0	We currently do not share personal data with third parties for their direct marketing purposes without your permission
0	0	Learn more about this and about our response to ¡°do not track??signals.
0	10	You can contact us or use other options to resolve any complaints.
4	0	If you have questions or complaints regarding this Policy, please first contact LinkedIn online
4	0	You can also reach us by physical mail
0	0	If contacting us does not resolve your complaint, you have more options
6	4	Residents in the Designated Countriemay also have the right to contact our Data Protection Officer here.
